Top queries,Clicks,Impressions,CTR,Position
olera,106,9632,1.1%,6.7
olera care,76,1159,6.56%,5.76
tj falohun,17,457,3.72%,4.02
olera.care,15,490,3.06%,2.33
does blue cross blue shield pay for family caregivers,12,536,2.24%,2.58
va caregiver functional assessment questions,12,173,6.94%,3.97
blue cross blue shield caregiver program,9,139,6.47%,3.28
veteran functional assessment instrument,8,129,6.2%,3.18
va caregiver home assessment,8,99,8.08%,1.97
does blue cross blue shield pay for in-home care,6,156,3.85%,1.62
does blue cross blue shield pay for caregiver,5,52,9.62%,1.5
stonewell senior care,4,309,1.29%,9.31
va caregiver veteran functional assessment,4,13,30.77%,1.77
va caregiver assessment questions,3,267,1.12%,2.35
mohan kunj austin,3,208,1.44%,9.02
how much is a nursing home per month near me,3,100,3%,5.6
non medical home care agency,2,367,0.54%,37.37
va caregiver approval letter,2,292,0.68%,8.49
va caregiver interview questions and answers,2,141,1.42%,2.99
veteran functional assessment questions,2,116,1.72%,2.72
va caregiver interview questions,2,60,3.33%,5.95
how much does private home care cost per hour near me,2,29,6.9%,2.14
does blue cross cover home care,2,15,13.33%,3.8
does blue cross blue shield pay for home health care,2,13,15.38%,1.46
functional assessment,2,5,40%,1
home care,1,10782,0.01%,40.8
home health care,1,3179,0.03%,37.86
assisted living reno,1,816,0.12%,50.66
nursing home near me,1,767,0.13%,35.99
apply for social security caregiver benefits,1,590,0.17%,4.91
assisted living near me,1,517,0.19%,34.09
skilled nursing facilities near me,1,445,0.22%,40.05
nursing facilities near me,1,394,0.25%,65.47
private nursing homes,1,294,0.34%,72.77
home care raleigh,1,153,0.65%,79.79
private nursing homes near me,1,130,0.77%,42.68
home care agencies near me,1,129,0.78%,23.09
independent living omaha,1,124,0.81%,44.96
yard services for seniors,1,120,0.83%,3.18
does blue cross blue shield cover home health care,1,110,0.91%,2.35
does social security pay for caregivers,1,109,0.92%,5.72
medical power of attorney rights and limitations,1,98,1.02%,27.83
does blue cross cover home health care,1,95,1.05%,2.33
yard work help for seniors,1,78,1.28%,9.15
how much do i pay a live-in caregiver,1,72,1.39%,6.99
how much do live in caregivers make,1,70,1.43%,7.37
does blue cross blue shield cover assisted living,1,68,1.47%,4.65
how to pass the va caregiver interview,1,68,1.47%,4.78
are caregivers allowed to give medication,1,65,1.54%,6.46
nursing homes shreveport,1,64,1.56%,60.86
care etc,1,61,1.64%,1.7
cost of nursing homes near me,1,61,1.64%,10.34
does bcbs cover home health care,1,58,1.72%,1.98
how much does a live in caregiver make,1,55,1.82%,5.38
can caregivers give medications,1,52,1.92%,9
who qualifies for the va caregiver program,1,51,1.96%,34.47
blue cross blue shield home care,1,48,2.08%,3.56
blue cross blue shield in home care,1,41,2.44%,3.12
assisted living in reno nv,1,38,2.63%,59.24
legal rights of a caregiver,1,36,2.78%,3.86
how much does social security pay a caregiver,1,35,2.86%,3.71
assisted living costs by zip code,1,34,2.94%,13.56
does blue cross blue shield cover home care,1,32,3.12%,3.38
va caregiver home visit,1,32,3.12%,5.16
nursing homes south dakota,1,31,3.23%,9.03
caretenders georgetown ky,1,29,3.45%,10.72
home health care agencies in houston,1,28,3.57%,82.04
assisted living in texas,1,27,3.7%,81.37
independent living duluth mn,1,25,4%,47.36
best home health care lawrence ma,1,24,4.17%,9.58
how much to pay a live in caregiver,1,22,4.55%,7.59
memory care oahu,1,22,4.55%,33.91
national family caregiver support program,1,21,4.76%,3
non medical in home care services,1,18,5.56%,56
va functional assessment,1,17,5.88%,2.76
longview crossing apartments,1,17,5.88%,10.12
jeswin vennatt,1,16,6.25%,15.25
long term care facilities in maryland,1,14,7.14%,73.29
bellbrook estates,1,13,7.69%,1.15
does blue cross cover long term care,1,13,7.69%,2.31
nursing home cost near me,1,13,7.69%,21.92
how to get approved for va caregiver,1,13,7.69%,24.54
va assessment,1,13,7.69%,33.85
how much does it cost to have a live in caregiver,1,12,8.33%,1
caregiver paperwork,1,12,8.33%,1.5
assisted living moscow idaho,1,12,8.33%,9.75
best nursing homes in south carolina,1,11,9.09%,10.82
va caregiver program requirements,1,10,10%,2.1
primary caregiver,1,10,10%,3
chevy chase gardens,1,10,10%,15.8
senior horizons at silver lake,1,9,11.11%,27.78
free lawn care for seniors near me prices,1,9,11.11%,53.56
archstone care center “where everyone is family” photos,1,8,12.5%,6.12
convalescent homes near me,1,8,12.5%,15.25
amada senior care toledo,1,8,12.5%,18.12
does blue cross blue shield pay for in home care,1,7,14.29%,2
the pendle home,1,7,14.29%,15
nursing homes in montgomery alabama,1,7,14.29%,37.86
nearest nursing home to me,1,6,16.67%,19.5
aloe home care,1,6,16.67%,45
va caregiver pay,1,4,25%,3
magnolia senior living,1,4,25%,5.5
costs of nursing homes near me,1,4,25%,23.25
assisted living facilities missoula mt,1,4,25%,58.25
ppl caregiver requirements,1,3,33.33%,3
how much live in caregiver,1,3,33.33%,5.67
caretaker forum,1,3,33.33%,10
"best nursing homes in toledo, ohio",1,3,33.33%,13
nursing care centers near me,1,3,33.33%,25.33
wisconsin caregiver law,1,3,33.33%,53.33
home health salina ks,1,3,33.33%,57.67
veteran caregiver,1,2,50%,1
donde solicitar ayuda por cuidar a un familiar,1,2,50%,2
nachweis pflegepauschbetrag,1,2,50%,2
family caregiver benefit application,1,2,50%,3
how to appeal va caregiver decision,1,2,50%,3
где фиксируется стаж по уходу за престарелыми,1,2,50%,3
va caregiver application online,1,2,50%,3.5
va caregiver application pdf,1,2,50%,4
how to apply for care allowance,1,2,50%,7
best independent,1,2,50%,7.5
nursing home blaine mn,1,2,50%,29.5
stratford house troy,1,2,50%,40
home health care agencies california,1,2,50%,63
care llc,1,1,100%,1
how to prove your a carer for someone,1,1,100%,1
support services,1,1,100%,1
apoyo bienestar para cuidadores de adultos mayores,1,1,100%,3
czy opiekunowi osoby niepełnosprawnej przysługuje dodatkowy urlop,1,1,100%,3
how do i qualify for carer allowance centrelink,1,1,100%,3
how to apply for grant in aid,1,1,100%,3
family care contract,1,1,100%,4
how much per month,1,1,100%,10
38 cfr 71.20,1,1,100%,12
credencial universal salud,1,1,100%,12
free caregiver documentation sample pdf,1,1,100%,12
"southlake village rehabilitation & care center, inc. photos",1,1,100%,26
manchester manor nursing home,1,1,100%,36
caregiver chat,1,1,100%,45
olera senior care directory requirements,0,60508,0%,2.89
olera senior care directory inclusion criteria,0,52723,0%,4.88
non medical home care,0,45963,0%,33.25
nursing home,0,31122,0%,69.54
home care near me,0,6084,0%,66.54
senior assisted living placement services common search terms 2024,0,3823,0%,13.45
non medical home care services,0,3593,0%,35.43
home care services,0,3202,0%,37.73
at home health care,0,3033,0%,30.29
independent living,0,2960,0%,48.55
olera senior care directory eligibility criteria,0,2941,0%,4.13
in home care,0,2261,0%,41.76
nursing homes,0,2206,0%,67.98
home care provider,0,2149,0%,32.38
"""first option home care"" ""92691""",0,1958,0%,4.41
elderly care,0,1844,0%,38.65
"""first option home care"" ""mission viejo""",0,1776,0%,3.55
in home care services,0,1748,0%,48.01
"""knobility health care services"" ""mission viejo""",0,1736,0%,5.24
"""knobility health care services"" ""92691""",0,1662,0%,5
nursing homes near me,0,1654,0%,24.95
assisted living atlantic city,0,1482,0%,48.47
assisted living,0,1372,0%,58.65
care at home,0,1359,0%,37.46
memory care atlantic city,0,1322,0%,52.58
senior living atlantic city,0,1303,0%,65.26
home care options,0,1191,0%,42.48
home care assistance,0,1132,0%,37.31
home care professionals,0,1109,0%,36.84
at home care,0,1023,0%,34.05
home care agency,0,1018,0%,50.61
home care solutions,0,962,0%,33.83
home care providers,0,944,0%,43.34
nursing care home,0,932,0%,77.59
independent living broomfield,0,905,0%,69.99
at home caregivers,0,894,0%,37.02
nursery home,0,888,0%,77.9
private home care,0,861,0%,41.85
cost of assisted living sacramento,0,817,0%,37.36
home care service,0,817,0%,41.62
memory care hempstead,0,793,0%,46.91
assisted living broomfield,0,762,0%,54.34
home care agencies,0,751,0%,31.85
olera categories healthcare providers,0,749,0%,3.75
personal care near me,0,749,0%,75.74
best assisted living in lexington,0,736,0%,42.79
55+ communities in clermont,0,712,0%,81.31
senior living community in west lafayette in,0,710,0%,57.44
55+ communities in mckinney tx,0,709,0%,66.21
home healthcare franklin,0,697,0%,20.59
independent living leland,0,683,0%,28.37
home care agency near me,0,672,0%,72.78
at home elder care,0,665,0%,32.46
memory care newark,0,651,0%,71.22
nursing home care,0,651,0%,71.26
at home elder care orland park,0,629,0%,80.09
assisted living in westminster co,0,618,0%,64.35
assisted living fargo,0,609,0%,62.43
senior living community west lafayette in,0,586,0%,50.49
assisted living texas,0,586,0%,81.29
care homes near me,0,585,0%,41.51
elderly home care,0,584,0%,40.63
non-medical home care,0,577,0%,49.95
home health services,0,575,0%,41.8
non medical in home care,0,574,0%,35.29
independent living palo alto,0,564,0%,63.84
independent living lafayette indiana west side,0,550,0%,51.28
retirement homes mountain view ca,0,548,0%,63.38
home health care for seniors,0,543,0%,45.64
in home care near me,0,542,0%,62.66
independent living maple-valley,0,541,0%,47.15
senior home,0,539,0%,62.46
affordable home care,0,536,0%,30.55
elder home care services,0,533,0%,30.47
nursing homes in new orleans,0,533,0%,47.04
non medical senior care,0,525,0%,47.7
long term care,0,518,0%,33.87
assisted living colorado springs,0,518,0%,72.39
choosing an elder law attorney,0,515,0%,76.61
senior living leland,0,505,0%,65.07
in-home care services,0,502,0%,54.53
home caregivers near me,0,502,0%,75
senior living,0,501,0%,49.3
home care st petersburg,0,494,0%,37.39
memory care bartlett il,0,493,0%,53.13
senior care near me,0,491,0%,27.58
at home care services,0,489,0%,32.72
assisted living washington dc,0,488,0%,46.96
home health care services,0,487,0%,45.77
retirement community mountain view ca,0,484,0%,53.91
independent living bergen county,0,480,0%,70.44
senior living new york,0,480,0%,88.89
senior care home,0,477,0%,59.44
independent living fairfax va,0,477,0%,60.91
senior home care,0,475,0%,33.81
senior living in bartlett il,0,474,0%,49.5
cost of memory care,0,468,0%,74.08
does medicare pay for a family caregiver,0,463,0%,35.76
senior living in hempstead ny,0,452,0%,54.38
memory care spokane,0,447,0%,70.18
senior living thornton,0,443,0%,61.74
cherry hill senior living,0,441,0%,72.04
elderly care options,0,439,0%,86.39
home health providers,0,438,0%,44.54
independent living leland nc,0,435,0%,42.2
nursing care homes near me,0,434,0%,65.32
home help for seniors,0,432,0%,42.42
memory care des moines,0,432,0%,44.91
senior housing west orange nj,0,432,0%,64.44
nursing homes nearby,0,428,0%,61.69
senior living in mountain view,0,428,0%,70.94
retirement homes new york,0,428,0%,76.46
assisted living santa fe,0,424,0%,56.12
elder care,0,422,0%,28.68
assisted living in rockland county new york,0,421,0%,79.51
retirement communities bartlett,0,420,0%,67.11
assisted living san francisco,0,420,0%,75.32
55+ communities in aurora co,0,420,0%,82.72
independent living bartlett,0,415,0%,40.7
home health,0,415,0%,51.71
fairfax independent living,0,409,0%,60.6
best memory care in lexington,0,408,0%,58.29
quality home care,0,407,0%,23.91
independent senior living illinois,0,404,0%,80.49
elderly home,0,402,0%,49.04
retirement communities palo alto ca,0,401,0%,76.22
independent living fairfax,0,400,0%,67.58
home caregivers maplewood nj,0,399,0%,39.69
nursing home care near me,0,398,0%,64.69
retirement communities in louisiana,0,397,0%,69.68
memory care parsippany-troy hills,0,393,0%,48.75
retirement community new york,0,390,0%,80.98
memory care tulsa,0,389,0%,61.03
home care indianapolis,0,389,0%,84.32
memory care omaha,0,388,0%,66.03
nursing care homes,0,388,0%,72.19
memory care downers grove,0,387,0%,44.54
home care aurora,0,386,0%,47.93
assisted living waukesha,0,386,0%,52.34
memory care cost per month in azusa,0,384,0%,7.7
in home care for seniors maplewood nj,0,382,0%,46.08
senior living leland nc,0,381,0%,63.1
live in caregiver cost,0,379,0%,17.99
home care services franklin,0,378,0%,22.81
senior home health care services,0,378,0%,27.99
assisted living facilities near me,0,378,0%,58.84
assisted living tuscaloosa,0,376,0%,52.9
home care houston,0,376,0%,81.68
home health care near me,0,374,0%,35.72
at home care franklin,0,372,0%,22.6
independent living sacramento,0,372,0%,67.04
at home care for seniors,0,371,0%,56.39
independent living west lafayette in,0,370,0%,56.98
montgomery al skilled nursing,0,369,0%,54.26
nursing care near me,0,369,0%,59.6
senior home care orland park,0,368,0%,76.45
cost of live in caregiver,0,367,0%,24.51
independent living toledo,0,366,0%,50.18
assisted living tacoma,0,365,0%,67.61
nonmedical home care,0,364,0%,50.2
assisted living cost,0,363,0%,40.04
senior care,0,362,0%,23.07
home care norman,0,362,0%,54.97
cost of assisted living,0,357,0%,36.36
memory care cherry hill nj,0,356,0%,45.96
home health care washington state,0,355,0%,41.38
senior care services,0,355,0%,58.49
in home caregivers near me,0,355,0%,68.2
franklin home health care,0,354,0%,24.02
local home care,0,354,0%,37.08
in-home care indianapolis,0,352,0%,78.14
home care for the elderly,0,351,0%,58.7
orland park in home care for seniors,0,350,0%,80.04
retirement communities in broomfield co,0,350,0%,81.26
assisted living facilities in elgin il,0,349,0%,66.06
independent living eugene,0,349,0%,67.44
assisted living las vegas,0,349,0%,79.7
olera categories home care services,0,346,0%,4.04
memory care asheville,0,346,0%,43.11
best nursing care ossining,0,345,0%,26.96
assisted living sugar land,0,345,0%,49.41
caregiver agencies near me,0,345,0%,69
in home care providers,0,344,0%,38.28
home health care provider,0,344,0%,47.47
senior living community louisiana,0,342,0%,70.51
assisted living warner robins,0,341,0%,53.62
new york senior living,0,340,0%,77.14
independent senior living lafayette indiana,0,339,0%,70.15
independent living in benton county,0,337,0%,47.61
in home care services maplewood nj,0,336,0%,42.56
nursing homes in metairie,0,334,0%,39.71
assisted living franklin tn,0,334,0%,49.87
home care for elderly,0,334,0%,53.89
independent living colorado springs,0,333,0%,81.02
independent living mountain view,0,332,0%,63.04
assisted living new orleans area,0,331,0%,81.95
personal home care,0,329,0%,42.78
care homes,0,327,0%,30.93
senior living montclair,0,327,0%,63.11
ms long term care facilities,0,327,0%,63.23
senior living in west lafayette indiana,0,327,0%,73.1
assisted living kenner,0,326,0%,43.33
home care services indianapolis,0,326,0%,88.9
mobile al nursing home,0,325,0%,56.96
caregiver agency near me,0,324,0%,73.31
nursing facilities,0,324,0%,82.27
senior housing westminster co,0,324,0%,82.3
home care companies,0,322,0%,25.95
home care ‎jamestown,0,321,0%,49.53
senior living near me,0,320,0%,29.09
independent living hackensack‎,0,319,0%,35.13
in home caregiver,0,317,0%,44.38
elderly care at home,0,316,0%,51.6
dementia care orland park il,0,316,0%,84.65
home care for seniors,0,313,0%,46.93
assisted living ohio,0,313,0%,67.04
cost of assisted living north dakota,0,312,0%,25.78
home instead senior care rancho cordova,0,311,0%,28
independent living elgin il,0,310,0%,68.47
home health care seattle,0,309,0%,74.57
leland nc retirement communities,0,309,0%,74.6
best home health agencies prescott valley arizona 2024,0,308,0%,7.9
assisted living reno nv,0,308,0%,37.8
senior assisted living near me,0,308,0%,56.03
home care texarkana,0,307,0%,49.92
assisted living new orleans la,0,307,0%,84.61
caregivers at home maplewood,0,306,0%,39.33
assisted living little rock,0,306,0%,64.98
mobile al skilled nursing,0,306,0%,67.55
dementia care cherry hill,0,306,0%,73.99
home care new york,0,306,0%,90.09
progressive,0,305,0%,2.95
senior living tacoma,0,305,0%,85.44
independent living apartments fairfax va,0,304,0%,71.9
55+ communities in chandler,0,304,0%,84.42
in home care services near me,0,303,0%,76.38
memory care,0,302,0%,36.3
at home care near me,0,300,0%,55.46
assisted living alabaster,0,300,0%,57.85
retirement communities in leland nc,0,299,0%,67.49
palo alto retirement communities,0,299,0%,78.72
home care marion,0,298,0%,56.83
assisted living montclair nj,0,297,0%,76.45
assisted living facilities in texas,0,297,0%,78.51
senior living kansas city,0,297,0%,90.38
phenix city al nursing home,0,295,0%,49.03
home memory care services longview tx,0,295,0%,65.62
senior living maple valley wa,0,294,0%,63.11
franklin home care agency,0,293,0%,26.06
home memory care longview tx,0,293,0%,69.59
home care lincoln,0,293,0%,76.13
independent living near me,0,292,0%,29.53
morningside of rock hill,0,291,0%,42.31
senior living new orleans,0,291,0%,78.27
medicare caregiver,0,290,0%,80.34
independent living in tacoma,0,288,0%,84.07
personal drivers for the elderly,0,287,0%,30.22
home care potomac md,0,287,0%,56.2
senior living west lafayette and lafayette in,0,287,0%,76.73
livewell,0,286,0%,6.38
independent living parsippany-troy hills,0,285,0%,38.36
independent living albuquerque,0,285,0%,68
oregon assisted living,0,285,0%,82.98
assisted living virginia beach,0,284,0%,47.63
senior living virginia beach,0,284,0%,79.36
personalized caregiving hacienda heights ca,0,283,0%,31.21
agency for caregivers maplewood nj,0,283,0%,48.31
assisted living thornton,0,283,0%,65.13
family home care services,0,282,0%,41.08
senior housing in west lafayette in,0,279,0%,79.47
how much does a caregiver cost,0,278,0%,14.48
fishkill caregiving services,0,278,0%,30.13
assisted living oregon,0,278,0%,76.26
assisted living virginia,0,278,0%,86.4
cost of assisted living montana,0,276,0%,27.29
nursing homes in waterloo iowa,0,276,0%,31.19
home care tuscaloosa,0,276,0%,41.3
memory care derry,0,276,0%,54.09
assisted living in benton county,0,275,0%,47.53
home care services near me,0,274,0%,55.8
non-medical in-home care,0,273,0%,29.74
hollywood assisted living comparison,0,272,0%,33.39
best assisted living near me,0,272,0%,53.42
senior living el paso,0,271,0%,53.65
senior living little rock,0,271,0%,63.22
home health agency franklin,0,270,0%,22.89
assisted living toledo,0,270,0%,64.86
paying for senior care,0,269,0%,51.03
senior living alabaster,0,269,0%,57.25
home care springfield,0,268,0%,61.48
fountain court senior living maple valley,0,268,0%,70.95
nursing homes in concord nc,0,267,0%,34.49
assisted living mckinney,0,267,0%,46.03
retirement homes in new orleans la,0,267,0%,76
senior living facilities,0,267,0%,77.52
senior living santa fe,0,266,0%,63.05
in home care indianapolis,0,266,0%,80.21
senior living in lafayette indiana,0,265,0%,79.66
"best memory care near me, azusa",0,264,0%,12.47
home health service,0,264,0%,28.41
in home health care,0,264,0%,47.75
senior living rye ny,0,264,0%,62.97
home nursing care in baytown,0,263,0%,40.78
memory care cost per month in alhambra,0,262,0%,9.27
does medicare pay for caregivers,0,262,0%,41.34
independent living fresno,0,262,0%,68.26
senior living reno,0,261,0%,69.67
luxury senior living palo alto,0,261,0%,71.56
personalized caregiving rowland heights ca,0,259,0%,29.96
home care agencies in st petersburg fl,0,259,0%,35.18
retirement community west lafayette in,0,259,0%,65.73
retirement community palo alto,0,259,0%,81.82
best nursing homes near me,0,257,0%,17.44
best assisted living near sacramento,0,257,0%,47.66
in-home memory care longview tx,0,257,0%,63.6
medicare caregiver pay,0,257,0%,65.16
independent living corpus christi,0,257,0%,69.04
nursing homes in brandon ms,0,256,0%,29.59
assisted living iowa city,0,256,0%,53.13
home healthcare huntington beach,0,255,0%,35.64
senior living fargo,0,255,0%,61.94
assisted living services,0,255,0%,72.17
in home care orland park,0,255,0%,77.77
assisted living elgin,0,254,0%,62.57
nursing care home near me,0,254,0%,74.6
how much does memory care usually cost each month?. i'm based in tustin.,0,253,0%,5.57
home health care agencies st petersburg fl,0,253,0%,33.38
elderly+home+care+hamilton+township+nj,0,253,0%,54.16
memory care alabaster,0,253,0%,58.21
assisted living west orange nj,0,253,0%,64.19
nursing homes in suffolk va,0,251,0%,34.86
nursing homes in greenwood indiana,0,251,0%,37.06
memory care cost per month in tustin,0,250,0%,13.39
assisted living albuquerque,0,250,0%,59.72
independent living muskegon,0,249,0%,54.52
assisted living council bluffs,0,249,0%,63.57
home care oklahoma city,0,249,0%,90.32
adult home care,0,247,0%,30.56
senior home care elmhurst,0,247,0%,70.66
retirement communities new york,0,247,0%,82.22
nursing homes in chesapeake va,0,246,0%,32.83
home+care+agencies+hamilton+township+nj,0,246,0%,42.13
at home memory care longview tx,0,246,0%,67.28
colorado assisted living,0,245,0%,70.29
senior living options fishkill,0,243,0%,39.35
assisted living warner robins ga,0,243,0%,40.1
"elderly home care services st. louis park, mn",0,243,0%,59.67
home health care naperville,0,243,0%,64.02
assisted living california,0,243,0%,72.9
in home care naperville,0,242,0%,70.28
senior living in schaumburg,0,242,0%,77.14
in home health care orland park il,0,242,0%,82.55
memory care fishkill,0,241,0%,35.43
in home care service,0,241,0%,44.75
independent living in wilmington nc,0,241,0%,60.18
home care seattle,0,241,0%,69.4
senior living lubbock,0,241,0%,74.59
retirement communities in fairfax va,0,241,0%,85.89
home care visalia,0,240,0%,48.06
memory care near me,0,239,0%,27.93
home health care st petersburg,0,239,0%,42.32
nursing home in oxnard,0,239,0%,44.69
assisted living sioux city,0,239,0%,64.75
caregiver service,0,238,0%,27.41
home care health services,0,238,0%,49.63
senior living palo alto,0,238,0%,73.17
home health care in franklin,0,237,0%,30.36
will medicare pay for home health care by family member,0,237,0%,44.76
home health huntington beach,0,237,0%,47.04
senior living iowa city,0,237,0%,60.45
memory care west orange nj,0,237,0%,76.24
assisted living facilities san francisco bay area,0,237,0%,77.05
ms long term care,0,237,0%,93.7
home senior care,0,236,0%,33.06
home care services houston,0,236,0%,83.46
"sheltered village woodstock, nursing home, woodstock",0,235,0%,15.14
home care oak ridge,0,235,0%,36.9
independent living santa fe,0,235,0%,58.68
independent living durham nc,0,235,0%,74.82
in home care houston,0,235,0%,81.09
home care kenner,0,234,0%,47.97
assisted living hilo,0,234,0%,61.42
nursing homes in wilmington de,0,234,0%,63.88
independent living lubbock,0,234,0%,74.74
memory care las cruces,0,233,0%,43.15
retirement communities,0,232,0%,61.08
montgomery al assisted living,0,232,0%,69.81
independent living little rock,0,232,0%,71.78
independent living wilmington nc,0,231,0%,57.05
alzheimers+home+care+hamilton+township+nj,0,231,0%,60.43
home care charlottesville,0,230,0%,51.53
elderly living,0,230,0%,62.03
assisted living parsippany-troy hills,0,230,0%,70.87
elderly care services,0,229,0%,45.73
in+home+caregiver+hamilton+township+nj,0,228,0%,38.25
senior living parsippany-troy hills,0,228,0%,51.88
memory care waukegan,0,228,0%,60.12
home care ‎davenport,0,228,0%,70.09
independent living reno,0,228,0%,79.11
independent senior living elmhurst,0,227,0%,39.08
senior living in elgin il,0,227,0%,54.99
caregiver fort lee,0,226,0%,45.3
senior living modesto,0,226,0%,61.17
caregiver near me,0,226,0%,70.5
skilled nursing near me,0,225,0%,39.78
assisted living bartlett il,0,225,0%,53.12
"senior home caregiver in minnetonka, mn",0,225,0%,64.94
california assisted living,0,225,0%,66.32
nursing homes moorhead,0,224,0%,46.61
home care in texas,0,223,0%,58.16
home care givers west orange,0,222,0%,38.7
in home care for seniors west orange nj,0,222,0%,51.2
in home care provider,0,222,0%,54.25
at home elder care naperville,0,222,0%,64.12
how much does memory care usually cost each month?. i'm based in azusa.,0,221,0%,4.35
"assisted living richmond ca,33,383,8.62%,4.7",0,221,0%,29.87
assisted living bowling green ky,0,220,0%,48.26
home care enfield,0,219,0%,35.21
assisted living bozeman,0,219,0%,35.31
independent living community elmhurst il,0,219,0%,44.93
in-home care,0,219,0%,46.43
assisted living springfield oregon,0,219,0%,49.89
senior living elgin il,0,219,0%,51.35
senior+home+care+hamilton+township+nj,0,219,0%,52.06
home care st. joseph,0,219,0%,60.05
assisted living green bay,0,219,0%,70.32
cost of assisted living alaska,0,218,0%,22.06
phenix city al skilled nursing,0,218,0%,43.39
nursing homes in long beach ny,0,217,0%,33.01
home health care aurora,0,217,0%,56.92
memory care green bay,0,217,0%,73.43
assisted living maryland,0,217,0%,81.41
assisted living des moines,0,216,0%,73.13
senior living philadelphia,0,216,0%,82.63
independent living phoenix,0,216,0%,86.73
home health care franklin,0,215,0%,26.25
independent living athens,0,215,0%,66.96
alzheimer's care facilities wilmington de,0,215,0%,73.33
best home health care companies prescott valley az 2024,0,214,0%,9.41
2333 manchester dr the village ok 73120 town name,0,214,0%,23.01
independent living city state,0,214,0%,23.48
home health in franklin,0,214,0%,27.22
senior living ‎laredo,0,214,0%,56.41
in-home memory care services longview tx,0,214,0%,63.62
elder care services,0,213,0%,33.47
elmhurst independent senior living,0,213,0%,35.44
affordable nursing homes,0,213,0%,39.84
home care waukegan,0,213,0%,45.61
memory care in benton county,0,213,0%,45.65
senior care services raymore,0,213,0%,51.15
elderly independent living,0,213,0%,65.35
home care ‎abilene,0,212,0%,55.78
caregiving near me,0,212,0%,61.26
site:olera.care,0,211,0%,10.31
assisted living owasso,0,211,0%,37.61
will medicare pay for a family member to be a caregiver,0,211,0%,43.74
assisted living shawnee oklahoma,0,211,0%,58.67
